{
  "$schema": "https://json-schema.org/draft/2020-12/schema",
  "title": "毒蘑菇留观联络网领域事件",
  "type": "object",
  "required": [
    "event_id",
    "event_type",
    "aggregate_type",
    "aggregate_id",
    "occurred_at",
    "version",
    "summary"
  ],
  "properties": {
    "event_id": {
      "type": "string",
      "minLength": 1
    },
    "event_type": {
      "type": "string",
      "enum": [
        "MEAL_INCIDENT_REGISTERED",
        "DINER_LINKED",
        "SPECIMEN_COLLECTED",
        "SPECIMEN_TRANSFERRED",
        "TOXIN_IDENTIFIED",
        "CLUE_RECORDED",
        "SYMPTOM_RECORDED",
        "LAB_RESULT_RECORDED",
        "LAB_RESULT_CORRECTED",
        "MEDICAL_ORDER_ISSUED",
        "TRANSFER_ARRANGED",
        "CONTACT_ATTEMPTED",
        "PROVISIONAL_IDENTITY_OPENED",
        "IDENTITY_CONFIRMED",
        "EPISODES_MERGED",
        "EPISODE_MERGE_REVERTED",
        "FOLLOWUP_DUE",
        "ESCALATION_RAISED",
        "OBSERVATION_CLOSED"
      ]
    },
    "aggregate_type": {
      "type": "string",
      "enum": [
        "meal_incident",
        "patient_episode",
        "specimen",
        "observation_plan"
      ]
    },
    "aggregate_id": {
      "type": "string",
      "minLength": 1
    },
    "occurred_at": {
      "type": "string",
      "format": "date-time"
    },
    "version": {
      "type": "integer",
      "minimum": 1
    },
    "summary": {
      "type": "string",
      "minLength": 1
    },
    "payload": {
      "type": "object"
    }
  },
  "additionalProperties": true
}
